{
  "schemaVersion": 2,
  "runTimestamp": "2026-07-06T11:04:32.667Z",
  "dslVersion": "1.2",
  "protocolVersion": 1,
  "implementations": [
    {
      "adapterName": "safe-docx",
      "adapterVersion": "0.15.0+git.459051c072da"
    },
    {
      "adapterName": "python-docx",
      "adapterVersion": "1.2.0"
    },
    {
      "adapterName": "libreoffice",
      "adapterVersion": "LibreOffice 24.2.7.2 420(Build:2)"
    },
    {
      "adapterName": "openxml-sdk",
      "adapterVersion": "DocumentFormat.OpenXml 3.5.1"
    },
    {
      "adapterName": "dolanmiu-docx",
      "adapterVersion": "9.7.1"
    },
    {
      "adapterName": "superdoc-sdk",
      "adapterVersion": "1.16.1"
    },
    {
      "adapterName": "docx-rs",
      "adapterVersion": "docx-rs 0.4.20"
    }
  ],
  "results": [
    {
      "scenarioId": "acceptDeletedParagraphMarkMergesParagraphs",
      "scenarioTitle": "Accepting a deleted paragraph mark merges the paragraph with the following paragraph",
      "specCitation": {
        "standard": "ECMA-376",
        "edition": 5,
        "part": 1,
        "section": "17.13.5.15",
        "clauseTitle": "del (Deleted Paragraph)"
      },
      "outcomes": {
        "safe-docx": {
          "status": "pass",
          "assertionResults": [
            {
              "assertionKind": "xpathQueryCount",
              "passed": true,
              "detail": "//w:body/w:p matched 1 node(s); expected 1"
            },
            {
              "assertionKind": "xpathQueryCount",
              "passed": true,
              "detail": "//w:pPr/w:rPr/w:del matched 0 node(s); expected 0"
            },
            {
              "assertionKind": "documentTextContainsAtOffset",
              "passed": true,
              "detail": "'First half second half' found at offset 0"
            }
          ]
        },
        "python-docx": {
          "status": "unsupported",
          "reason": "python-docx has no tracked-changes (revision) API"
        },
        "libreoffice": {
          "status": "pass",
          "assertionResults": [
            {
              "assertionKind": "xpathQueryCount",
              "passed": true,
              "detail": "//w:body/w:p matched 1 node(s); expected 1"
            },
            {
              "assertionKind": "xpathQueryCount",
              "passed": true,
              "detail": "//w:pPr/w:rPr/w:del matched 0 node(s); expected 0"
            },
            {
              "assertionKind": "documentTextContainsAtOffset",
              "passed": true,
              "detail": "'First half second half' found at offset 0"
            }
          ]
        },
        "openxml-sdk": {
          "status": "unsupported",
          "reason": "the Open XML SDK is a typed DOM over the package with no accept/reject-revisions API; implementing one would be an adapter-side algorithm"
        },
        "dolanmiu-docx": {
          "status": "unsupported",
          "reason": "dolanmiu/docx can generate revision markup but exposes no API to accept or reject existing tracked changes"
        },
        "superdoc-sdk": {
          "status": "unsupported",
          "reason": "SuperDoc SDK does not expose paragraph-mark tracked changes through trackChanges.list"
        },
        "docx-rs": {
          "status": "unsupported",
          "reason": "docx-rs can generate revision markup but exposes no API to accept or reject existing tracked changes"
        }
      },
      "scenarioGroup": "tracked-changes"
    },
    {
      "scenarioId": "acceptDeletionsRemovesDelContent",
      "scenarioTitle": "Accepting deletions removes w:del wrappers and their content",
      "specCitation": {
        "standard": "ECMA-376",
        "edition": 5,
        "part": 1,
        "section": "17.13.5.14",
        "clauseTitle": "del (Deleted Run Content)"
      },
      "outcomes": {
        "safe-docx": {
          "status": "pass",
          "assertionResults": [
            {
              "assertionKind": "xpathQueryCount",
              "passed": true,
              "detail": "//w:del matched 0 node(s); expected 0"
            },
            {
              "assertionKind": "xpathQueryCount",
              "passed": true,
              "detail": "//w:delText matched 0 node(s); expected 0"
            },
            {
              "assertionKind": "documentTextContainsAtOffset",
              "passed": true,
              "detail": "'Kept text' found at offset 0"
            },
            {
              "assertionKind": "canonicalXmlEquals",
              "passed": true,
              "detail": "canonical forms are identical"
            }
          ]
        },
        "python-docx": {
          "status": "unsupported",
          "reason": "python-docx has no tracked-changes (revision) API"
        },
        "libreoffice": {
          "status": "pass-divergent",
          "assertionResults": [
            {
              "assertionKind": "xpathQueryCount",
              "passed": true,
              "detail": "//w:del matched 0 node(s); expected 0"
            },
            {
              "assertionKind": "xpathQueryCount",
              "passed": true,
              "detail": "//w:delText matched 0 node(s); expected 0"
            },
            {
              "assertionKind": "documentTextContainsAtOffset",
              "passed": true,
              "detail": "'Kept text' found at offset 0"
            },
            {
              "assertionKind": "canonicalXmlEquals",
              "passed": false,